{
  "schema": "atlas.rtl_timing.contract.v0",
  "document_state": "draft",
  "target": {
    "config": "EE290SimConfig",
    "reference": "https://github.com/ucb-ee194-tapeout/bringup-chipyard/blob/main/generators/chipyard/src/main/scala/config/AtlasConfigs.scala#L12-L25"
  },
  "build": {
    "config": "EE290SimConfig",
    "command": null,
    "sources": [
      {
        "repository": "https://github.com/ucb-ee194-tapeout/bringup-chipyard",
        "revision": null,
        "local_changes_sha256": null,
        "selection_complete": false
      }
    ],
    "firrtl": null,
    "annotations": [],
    "hardware_ir": null,
    "simulator": null,
    "tools": [],
    "provenance": null
  },
  "catalog": {
    "path": "../operation-catalog.json",
    "sha256": "4a991a7ceff88f53de9224ec0dddd45f949cbba09c3fe05ae483563d2f1c6944",
    "compiler_revision": "7b1e3dab55c2d0bd05d51c8f6ec48e55bcedeb58",
    "decoder_reference": "../../selected-variant-census.md: compiler baseline at atlas-npu 0079c0541111197741a231c002e3843fa6f545b2; no public EE290SimConfig build is bound by this example"
  },
  "conventions": {
    "cycle_domain": "atlas_core_clock",
    "age_origin": "instruction_issue",
    "hold_end": "inclusive",
    "memory_range": "half_open_bytes_after_effective_address_transform",
    "unknown_value": null,
    "event_mapping": "selected_target_unqualified",
    "events": [
      {
        "id": "attempted_issue",
        "cycle_domain": "atlas_core_clock",
        "signal": null,
        "edge": "unknown",
        "condition": null,
        "reference_event": "instruction_issue",
        "relation": "unknown",
        "offset_cycles": null,
        "coverage": "selected_target_unqualified"
      },
      {
        "id": "instruction_issue",
        "cycle_domain": "atlas_core_clock",
        "signal": null,
        "edge": "unknown",
        "condition": null,
        "reference_event": null,
        "relation": "origin",
        "offset_cycles": 0,
        "coverage": "selected_target_unqualified"
      },
      {
        "id": "engine_accept",
        "cycle_domain": "atlas_core_clock",
        "signal": null,
        "edge": "unknown",
        "condition": null,
        "reference_event": "instruction_issue",
        "relation": "unknown",
        "offset_cycles": null,
        "coverage": "selected_target_unqualified"
      },
      {
        "id": "first_operand_read",
        "cycle_domain": "atlas_core_clock",
        "signal": null,
        "edge": "unknown",
        "condition": null,
        "reference_event": "instruction_issue",
        "relation": "unknown",
        "offset_cycles": null,
        "coverage": "selected_target_unqualified"
      },
      {
        "id": "last_operand_read",
        "cycle_domain": "atlas_core_clock",
        "signal": null,
        "edge": "unknown",
        "condition": null,
        "reference_event": "instruction_issue",
        "relation": "unknown",
        "offset_cycles": null,
        "coverage": "selected_target_unqualified"
      },
      {
        "id": "first_result_write",
        "cycle_domain": "atlas_core_clock",
        "signal": null,
        "edge": "unknown",
        "condition": null,
        "reference_event": "instruction_issue",
        "relation": "unknown",
        "offset_cycles": null,
        "coverage": "selected_target_unqualified"
      },
      {
        "id": "last_result_write",
        "cycle_domain": "atlas_core_clock",
        "signal": null,
        "edge": "unknown",
        "condition": null,
        "reference_event": "instruction_issue",
        "relation": "unknown",
        "offset_cycles": null,
        "coverage": "selected_target_unqualified"
      },
      {
        "id": "engine_release",
        "cycle_domain": "atlas_core_clock",
        "signal": null,
        "edge": "unknown",
        "condition": null,
        "reference_event": "instruction_issue",
        "relation": "unknown",
        "offset_cycles": null,
        "coverage": "selected_target_unqualified"
      },
      {
        "id": "transfer_complete",
        "cycle_domain": "atlas_core_clock",
        "signal": null,
        "edge": "unknown",
        "condition": null,
        "reference_event": "instruction_issue",
        "relation": "unknown",
        "offset_cycles": null,
        "coverage": "selected_target_unqualified"
      },
      {
        "id": "wait_successful_issue",
        "cycle_domain": "atlas_core_clock",
        "signal": null,
        "edge": "unknown",
        "condition": null,
        "reference_event": "instruction_issue",
        "relation": "unknown",
        "offset_cycles": null,
        "coverage": "selected_target_unqualified"
      },
      {
        "id": "wait_return",
        "cycle_domain": "atlas_core_clock",
        "signal": null,
        "edge": "unknown",
        "condition": null,
        "reference_event": "instruction_issue",
        "relation": "unknown",
        "offset_cycles": null,
        "coverage": "selected_target_unqualified"
      },
      {
        "id": "halt_observed",
        "cycle_domain": "atlas_core_clock",
        "signal": null,
        "edge": "unknown",
        "condition": null,
        "reference_event": "instruction_issue",
        "relation": "unknown",
        "offset_cycles": null,
        "coverage": "selected_target_unqualified"
      }
    ]
  },
  "policy": {
    "identity_mismatch": "reject",
    "missing_operation": "reject",
    "unknown_resolver": "reject",
    "unqualified_safety_rule": "reject",
    "cost_estimates_affect_legality": false
  },
  "resources": [
    {
      "id": "xreg",
      "kind": "storage",
      "element_unit": "register",
      "dimensions": [
        "register"
      ],
      "properties": [
        {
          "id": "xreg.entries",
          "value": null,
          "unit": "registers",
          "basis": "unknown",
          "coverage": "selected_target_unqualified"
        },
        {
          "id": "xreg.width",
          "value": null,
          "unit": "bits",
          "basis": "unknown",
          "coverage": "selected_target_unqualified"
        }
      ],
      "coverage": "selected_target_unqualified"
    },
    {
      "id": "ereg",
      "kind": "storage",
      "element_unit": "register",
      "dimensions": [
        "register"
      ],
      "properties": [
        {
          "id": "ereg.entries",
          "value": null,
          "unit": "registers",
          "basis": "unknown",
          "coverage": "selected_target_unqualified"
        },
        {
          "id": "ereg.width",
          "value": null,
          "unit": "bits",
          "basis": "unknown",
          "coverage": "selected_target_unqualified"
        }
      ],
      "coverage": "selected_target_unqualified"
    },
    {
      "id": "mreg",
      "kind": "storage",
      "element_unit": "row",
      "dimensions": [
        "register",
        "row"
      ],
      "properties": [
        {
          "id": "mreg.logical_registers",
          "value": null,
          "unit": "registers",
          "basis": "unknown",
          "coverage": "selected_target_unqualified"
        },
        {
          "id": "mreg.rows_per_register",
          "value": null,
          "unit": "rows",
          "basis": "unknown",
          "coverage": "selected_target_unqualified"
        },
        {
          "id": "mreg.row_bytes",
          "value": null,
          "unit": "bytes",
          "basis": "unknown",
          "coverage": "selected_target_unqualified"
        },
        {
          "id": "mreg.physical_banks",
          "value": null,
          "unit": "banks",
          "basis": "unknown",
          "coverage": "selected_target_unqualified"
        },
        {
          "id": "mreg.physical_rows_per_bank",
          "value": null,
          "unit": "rows",
          "basis": "unknown",
          "coverage": "selected_target_unqualified"
        },
        {
          "id": "mreg.bank_index_bits",
          "value": null,
          "unit": "inclusive_bit_indices",
          "basis": "unknown",
          "coverage": "selected_target_unqualified"
        },
        {
          "id": "mreg.register_half_bit",
          "value": null,
          "unit": "bit_index",
          "basis": "unknown",
          "coverage": "selected_target_unqualified"
        },
        {
          "id": "mreg.memory_declaration.depth",
          "value": null,
          "unit": "rows",
          "basis": "unknown",
          "coverage": "selected_target_unqualified"
        },
        {
          "id": "mreg.memory_declaration.width",
          "value": null,
          "unit": "bits",
          "basis": "unknown",
          "coverage": "selected_target_unqualified"
        },
        {
          "id": "mreg.memory_declaration.readPorts",
          "value": null,
          "unit": "ports",
          "basis": "unknown",
          "coverage": "selected_target_unqualified"
        },
        {
          "id": "mreg.memory_declaration.writePorts",
          "value": null,
          "unit": "ports",
          "basis": "unknown",
          "coverage": "selected_target_unqualified"
        },
        {
          "id": "mreg.memory_declaration.readwritePorts",
          "value": null,
          "unit": "ports",
          "basis": "unknown",
          "coverage": "selected_target_unqualified"
        },
        {
          "id": "mreg.memory_declaration.readLatency",
          "value": null,
          "unit": "cycles",
          "basis": "unknown",
          "coverage": "selected_target_unqualified"
        },
        {
          "id": "mreg.memory_declaration.writeLatency",
          "value": null,
          "unit": "cycles",
          "basis": "unknown",
          "coverage": "selected_target_unqualified"
        }
      ],
      "coverage": "selected_target_unqualified"
    },
    {
      "id": "acc",
      "kind": "storage",
      "element_unit": "row",
      "dimensions": [
        "mxu",